A1: Synch | B1: Run Number (Time in milliseconds)
A2: Method | B2: 1 | C2: 2 | D2: 3 | E2: 4 | F2: 5 | G2: Ave | H2: Penalty
A3: None | B3: 312 | C3: 328 | D3: 312 | E3: 328 | F3: 312 | G3: =AVERAGE(B3:F3) -> 318.4 | H3: =G3/G3 -> 1.00
A4: Lock | B4: 531 | C4: 500 | D4: 515 | E4: 500 | F4: 515 | G4: =AVERAGE(B4:F4) -> 512.2 | H4: =G4/G3 -> 1.608668341708543
A5: Invoke | B5: 98953 | C5: 101718 | D5: 99796 | E5: 99437 | F5: 99453 | G5: =AVERAGE(B5:F5) -> 99871.4 | H5: =G5/G3 -> 313.66645728643215